<?xml version="1.0" encoding="UTF-8"?>
<ns0:nodeList xmlns:xsi="http://www.w3.org/2001/XMLSchema-instance"
	xmlns:ns0="de/uniluebeck/itm/metadatenservice/config"
	xsi:schemaLocation="de/uniluebeck/itm/metadatenservice/config sensors.xsd ">
	<ns0:node>
		<ns0:nodeid>3</ns0:nodeid>
		<ns0:description>wisebed</ns0:description>
		<ns0:microcontroller>TI MSP430</ns0:microcontroller>
		<ns0:ipAddress></ns0:ipAddress>
		<ns0:Port>1237</ns0:Port>
		<ns0:capability>
			<ns0:name>urn:wisebed:node:capability:temp</ns0:name>
			<ns0:datatype>integer</ns0:datatype>
			<ns0:unit>celsius</ns0:unit>
			<ns0:default>2</ns0:default>
		</ns0:capability>
		<ns0:capability>
			<ns0:name>urn:wisebed:node:capability:light</ns0:name>
			<ns0:datatype>integer</ns0:datatype>
			<ns0:unit>lux</ns0:unit>
			<ns0:default>2</ns0:default>
		</ns0:capability>
	</ns0:node>
	<ns0:node>
		<ns0:nodeid>4</ns0:nodeid>
		<ns0:description>wisebed</ns0:description>
		<ns0:microcontroller>TI MSP430</ns0:microcontroller>
		<ns0:ipAddress></ns0:ipAddress>
		<ns0:Port>1237</ns0:Port>
		<ns0:capability>
			<ns0:name>urn:wisebed:node:capability:temp</ns0:name>
			<ns0:datatype>integer</ns0:datatype>
			<ns0:unit>celsius</ns0:unit>
			<ns0:default>2</ns0:default>
		</ns0:capability>
		<ns0:capability>
			<ns0:name>urn:wisebed:node:capability:light</ns0:name>
			<ns0:datatype>integer</ns0:datatype>
			<ns0:unit>lux</ns0:unit>
			<ns0:default>2</ns0:default>
		</ns0:capability>
	</ns0:node>
</ns0:nodeList>

